[
  {
    "event_id": "evt_001",
    "event_type": "assertion.proposed",
    "timestamp": "2025-12-31T10:00:00Z",
    "severity": "info",
    "scope": "local",
    "actor_id": "person_alice",
    "assertion_id": "assert_001",
    "metadata": {
      "predicate": "owns",
      "subject": "person_alice"
    }
  },
  {
    "event_id": "evt_002",
    "event_type": "assertion.validated",
    "timestamp": "2025-12-31T10:00:05Z",
    "severity": "info",
    "scope": "local",
    "assertion_id": "assert_001",
    "source": "assertion_validator",
    "metadata": {
      "validation_duration_ms": 15,
      "checks_passed": ["schema", "predicate", "object_kind", "scope"]
    }
  },
  {
    "event_id": "evt_003",
    "event_type": "assertion.rejected",
    "timestamp": "2025-12-31T10:15:00Z",
    "severity": "error",
    "scope": "local",
    "assertion_id": "assert_bad_001",
    "actor_id": "service_data_ingestion",
    "reason": "Invalid predicate: unknown_predicate not found in assertion vocabulary",
    "errors": [
      {
        "code": "INVALID_PREDICATE",
        "field": "predicate",
        "message": "Predicate 'unknown_predicate' not found in assertion vocabulary"
      }
    ]
  },
  {
    "event_id": "evt_004",
    "event_type": "pack.loaded",
    "timestamp": "2025-12-31T09:00:00Z",
    "severity": "info",
    "scope": "local",
    "pack_id": "identity",
    "node_id": "node_primary",
    "metadata": {
      "version": "0.1.0",
      "definitions_count": 4,
      "load_duration_ms": 45
    }
  },
  {
    "event_id": "evt_005",
    "event_type": "pack.validation_failed",
    "timestamp": "2025-12-31T09:05:00Z",
    "severity": "error",
    "scope": "local",
    "pack_id": "invalid_pack",
    "node_id": "node_primary",
    "reason": "Pack manifest missing required field 'pack_id'",
    "errors": [
      {
        "code": "MANIFEST_ERROR",
        "message": "Missing required field: pack_id"
      }
    ]
  },
  {
    "event_id": "evt_006",
    "event_type": "node.started",
    "timestamp": "2025-12-31T08:00:00Z",
    "severity": "info",
    "scope": "local",
    "node_id": "node_primary",
    "metadata": {
      "version": "0.1.0",
      "hostname": "enki-node-01",
      "environment": "production"
    }
  },
  {
    "event_id": "evt_007",
    "event_type": "node.heartbeat",
    "timestamp": "2025-12-31T12:00:00Z",
    "severity": "info",
    "scope": "local",
    "node_id": "node_primary",
    "metadata": {
      "status": "healthy",
      "uptime_seconds": 14400,
      "packs_loaded": 4,
      "assertions_validated": 127
    }
  },
  {
    "event_id": "evt_008",
    "event_type": "usage.meter_tick",
    "timestamp": "2025-12-31T13:00:00Z",
    "severity": "info",
    "scope": "local",
    "node_id": "node_primary",
    "metadata": {
      "period": "hourly",
      "metrics": {
        "assertions_proposed": 15,
        "assertions_validated": 14,
        "assertions_rejected": 1,
        "pack_loads": 0,
        "api_calls": 203
      }
    }
  },
  {
    "event_id": "evt_009",
    "event_type": "validation.started",
    "timestamp": "2025-12-31T14:00:00Z",
    "severity": "info",
    "scope": "local",
    "target_id": "assert_batch_001",
    "target_type": "assertion_batch",
    "metadata": {
      "batch_size": 50,
      "validator": "assertion_validator_v1"
    }
  },
  {
    "event_id": "evt_010",
    "event_type": "validation.completed",
    "timestamp": "2025-12-31T14:00:02Z",
    "severity": "info",
    "scope": "local",
    "target_id": "assert_batch_001",
    "target_type": "assertion_batch",
    "metadata": {
      "batch_size": 50,
      "valid_count": 50,
      "invalid_count": 0,
      "duration_ms": 2340
    }
  },
  {
    "event_id": "evt_011",
    "event_type": "node.stopped",
    "timestamp": "2025-12-31T23:45:00Z",
    "severity": "critical",
    "scope": "local",
    "node_id": "node_secondary",
    "reason": "Unhandled exception: Out of memory",
    "metadata": {
      "exit_code": 1,
      "last_operation": "pack.loaded"
    }
  },
  {
    "event_id": "evt_012",
    "event_type": "assertion.accepted",
    "timestamp": "2025-12-31T15:30:00Z",
    "severity": "info",
    "scope": "shared",
    "actor_id": "ai_agent_analyzer",
    "assertion_id": "assert_ai_001",
    "metadata": {
      "source": "ai_inference_pipeline",
      "confidence": 0.95
    }
  }
]
